{"allowed_agents":["Forseti","Bragi"],"description":"Reviewed code and security assurance procedures for bounded GitHub pull-request patches.","digest":"be1cb59af8860f8a19df26d18bae655a7db0a079e2273ec15ebcb34c21422e71","instruction":"Run both procedures against the same immutable base and head SHAs. Report incomplete patch coverage before findings.","members":[{"name":"code-assurance.code-review","version":"==1.0.0"},{"name":"code-assurance.security-review","version":"==1.0.0"}],"name":"code-assurance.review-pack","required_tools":["code-assurance.review-pr","code-assurance.security-review"],"source":"package:fdai-code-assurance","version":"1.0.0"}